"Status","Start Time","Stop Time","Duration in ms","Parent Suite","Suite","Sub Suite","Test Class","Test Method","Name","Description"
"passed","Thu Oct 30 12:59:11 GMT 2025","Thu Oct 30 12:59:11 GMT 2025","410","","Test DOT SDK","","Test DOT SDK Test Get DOT Address test get index 0 address","","Test DOT SDK Test Get DOT Address test get index 0 address",""
"passed","Thu Oct 30 12:59:11 GMT 2025","Thu Oct 30 12:59:11 GMT 2025","368","","Test DOT SDK","","Test KSM SDK Test Get KSM Address test get index 0 address","","Test KSM SDK Test Get KSM Address test get index 0 address",""
"skipped","Thu Oct 30 12:59:11 GMT 2025","Thu Oct 30 12:59:11 GMT 2025","0","","Test DOT SDK","","Test DOT SDK Test DOT Transfer test transfer with address 0","","Test DOT SDK Test DOT Transfer test transfer with address 0",""
"passed","Thu Oct 30 12:59:11 GMT 2025","Thu Oct 30 12:59:11 GMT 2025","509","","Test DOT SDK","","Test KSM SDK Test KSM Transfer transfer with address 0 and metadatahash","","Test KSM SDK Test KSM Transfer transfer with address 0 and metadatahash",""
"passed","Thu Oct 30 12:59:11 GMT 2025","Thu Oct 30 12:59:11 GMT 2025","380","","Test DOT SDK","","Test KSM SDK Test KSM Transfer transfer with address 0","","Test KSM SDK Test KSM Transfer transfer with address 0",""
