"DESCRIPTION","DURATION IN MS","NAME","PARENT SUITE","START TIME","STATUS","STOP TIME","SUB SUITE","SUITE","TEST CLASS","TEST METHOD"
"","495","Test LTC SDK Test Get index 0 address","","Wed Jun 17 02:51:55 UTC 2026","passed","Wed Jun 17 02:51:55 UTC 2026","","Test LTC SDK","Test LTC SDK Test Get index 0 address",""
"","557","Test BCH SDK BCH test get address 0","","Wed Jun 17 02:51:46 UTC 2026","passed","Wed Jun 17 02:51:46 UTC 2026","","Test BCH SDK","Test BCH SDK BCH test get address 0",""
"","159","Test BCH SDK BCH signTransaction to address starts with 3 and no changes","","Wed Jun 17 02:51:46 UTC 2026","passed","Wed Jun 17 02:51:46 UTC 2026","","Test BCH SDK","Test BCH SDK BCH signTransaction to address starts with 3 and no changes",""
"","251","Test BCH SDK BCH signTransaction to address starts with 3","","Wed Jun 17 02:51:46 UTC 2026","passed","Wed Jun 17 02:51:46 UTC 2026","","Test BCH SDK","Test BCH SDK BCH signTransaction to address starts with 3",""
"","159","Test ZEC SDK Test Get Address P2PKH","","Wed Jun 17 02:52:05 UTC 2026","passed","Wed Jun 17 02:52:05 UTC 2026","","Test ZEC SDK","Test ZEC SDK Test Get Address P2PKH",""
"","319","Test ZEC SDK Test Sign Transfer Tx P2PKH","","Wed Jun 17 02:52:05 UTC 2026","passed","Wed Jun 17 02:52:05 UTC 2026","","Test ZEC SDK","Test ZEC SDK Test Sign Transfer Tx P2PKH",""
"","342","Test BCH SDK BCH signTransaction to address starts with 1","","Wed Jun 17 02:51:46 UTC 2026","passed","Wed Jun 17 02:51:46 UTC 2026","","Test BCH SDK","Test BCH SDK BCH signTransaction to address starts with 1",""
"","592","Test LTC SDK Test Sign Transfer LTC Transaction","","Wed Jun 17 02:51:55 UTC 2026","passed","Wed Jun 17 02:51:55 UTC 2026","","Test LTC SDK","Test LTC SDK Test Sign Transfer LTC Transaction",""
