"Status","Start Time","Stop Time","Duration in ms","Parent Suite","Suite","Sub Suite","Test Class","Test Method","Name","Description"
"passed","Thu May 22 01:38:18 GMT 2025","Thu May 22 01:38:18 GMT 2025","175","","Test BTC SDK","","Test BTC SDK Sign Transfer Tx P2SH_P2WPKH(Custom Segwit)","","Test BTC SDK Sign Transfer Tx P2SH_P2WPKH(Custom Segwit)",""
"passed","Thu May 22 01:38:18 GMT 2025","Thu May 22 01:38:18 GMT 2025","294","","Test BTC SDK","","Test BTC SDK Sign Transfer Tx P2TR(Taproot)","","Test BTC SDK Sign Transfer Tx P2TR(Taproot)",""
"failed","Thu May 22 01:38:18 GMT 2025","Thu May 22 01:38:18 GMT 2025","149","","Test BTC SDK","","Test BTC SDK Test Get Address P2PKH","","Test BTC SDK Test Get Address P2PKH",""
"passed","Thu May 22 01:38:18 GMT 2025","Thu May 22 01:38:18 GMT 2025","1","","Test BTC SDK","","Test BTC SDK Test Get Address P2WPKH","","Test BTC SDK Test Get Address P2WPKH",""
"passed","Thu May 22 01:38:18 GMT 2025","Thu May 22 01:38:18 GMT 2025","11","","Test BTC SDK","","Test BTC SDK Test Get Address P2TR","","Test BTC SDK Test Get Address P2TR",""
"passed","Thu May 22 01:38:18 GMT 2025","Thu May 22 01:38:18 GMT 2025","3","","Test BTC SDK","","Test BTC SDK Test Get Address P2SH_P2WPKH","","Test BTC SDK Test Get Address P2SH_P2WPKH",""
